<?xml version="1.0" encoding="UTF-8"?>
<!DOCTYPE sidras SYSTEM "Sidra.dtd">
 <sidras>
     <sidra>
         <titulo>EL GAITERO sidra achampanada etiqueta blanca botella 75 cl.</titulo>
         <rutaFoto>../img/00118730600188____2__600x600.jpg</rutaFoto>
         <nombre>El Gaitero</nombre>
         <descripcion>La sidra tradicional de El Gaitero por excelencia, espumosa, que empezó a producirse ya a finales del siglo XIX en todo el mundo. Ésta es una sidra semiseca singular, obtenida por elaboración tradicional y de gran riqueza aromática, espumosa y con formación de rosarios de gran finura en la burbuja.</descripcion>
         <precio unidad="€">1,52</precio>
         <porcentaje_alcohol cantidad="100" unidad="%">4.1</porcentaje_alcohol>
         <cantidad_neta cantidad="100" unidad="cl">75</cantidad_neta>
     </sidra>
 </sidras>
     